{
  "id": "StarterBaselineCandidate",
  "revision": 1,
  "model_version": "strata/0.3-block-lifecycle-experimental",
  "baseline": "StarterCollection@1",
  "proposals": [],
  "selected": [],
  "alternative_groups": [],
  "scenario": {
    "id": "bounded-collection",
    "checks": [
      {
        "id": "collection.compatibility",
        "version": "1"
      }
    ]
  },
  "resolutions": []
}
